{
  "id": "kidney-01",
  "name": "Kidney Circuit",
  "lapsToWin": 3,
  "path": [
    {
      "x": 569.31,
      "y": 565.54
    },
    {
      "x": 529.16,
      "y": 567.3
    },
    {
      "x": 488.98,
      "y": 568.14
    },
    {
      "x": 448.8,
      "y": 568.15
    },
    {
      "x": 408.62,
      "y": 567.28
    },
    {
      "x": 368.48,
      "y": 565.4
    },
    {
      "x": 328.33,
      "y": 563.6
    },
    {
      "x": 288.31,
      "y": 560.13
    },
    {
      "x": 249.27,
      "y": 550.93
    },
    {
      "x": 214.04,
      "y": 531.86
    },
    {
      "x": 184.25,
      "y": 504.99
    },
    {
      "x": 160.59,
      "y": 472.6
    },
    {
      "x": 145.48,
      "y": 435.5
    },
    {
      "x": 139.49,
      "y": 395.83
    },
    {
      "x": 140.4,
      "y": 355.7
    },
    {
      "x": 147.4,
      "y": 316.16
    },
    {
      "x": 160.78,
      "y": 278.33
    },
    {
      "x": 181.93,
      "y": 244.29
    },
    {
      "x": 210.31,
      "y": 215.91
    },
    {
      "x": 242.7,
      "y": 192.17
    },
    {
      "x": 278.12,
      "y": 173.3
    },
    {
      "x": 316.63,
      "y": 162.1
    },
    {
      "x": 356.6,
      "y": 158.21
    },
    {
      "x": 396.71,
      "y": 159.5
    },
    {
      "x": 436.04,
      "y": 167.65
    },
    {
      "x": 475.35,
      "y": 175.95
    },
    {
      "x": 515.4,
      "y": 177.16
    },
    {
      "x": 554.9,
      "y": 169.92
    },
    {
      "x": 594.1,
      "y": 161.1
    },
    {
      "x": 634.08,
      "y": 158.13
    },
    {
      "x": 673.98,
      "y": 162.54
    },
    {
      "x": 712.66,
      "y": 173.31
    },
    {
      "x": 749.68,
      "y": 188.88
    },
    {
      "x": 784.95,
      "y": 208.12
    },
    {
      "x": 817.52,
      "y": 231.57
    },
    {
      "x": 841.99,
      "y": 263.16
    },
    {
      "x": 858.0,
      "y": 300.0
    },
    {
      "x": 874.17,
      "y": 336.78
    },
    {
      "x": 882.41,
      "y": 375.85
    },
    {
      "x": 874.02,
      "y": 414.99
    },
    {
      "x": 855.59,
      "y": 450.59
    },
    {
      "x": 829.1,
      "y": 480.69
    },
    {
      "x": 798.1,
      "y": 506.22
    },
    {
      "x": 764.33,
      "y": 527.96
    },
    {
      "x": 728.02,
      "y": 545.11
    },
    {
      "x": 689.37,
      "y": 555.91
    },
    {
      "x": 649.56,
      "y": 561.27
    },
    {
      "x": 609.46,
      "y": 563.81
    }
  ],
  "width": 130,
  "startLine": {
    "a": {
      "x": 572.95,
      "y": 648.46
    },
    "b": {
      "x": 565.67,
      "y": 482.62
    }
  },
  "checkpoints": [
    {
      "a": {
        "x": 63.41,
        "y": 447.9
      },
      "b": {
        "x": 227.55,
        "y": 423.11
      }
    },
    {
      "a": {
        "x": 453.18,
        "y": 86.44
      },
      "b": {
        "x": 418.9,
        "y": 248.86
      }
    },
    {
      "a": {
        "x": 933.98,
        "y": 266.59
      },
      "b": {
        "x": 782.02,
        "y": 333.41
      }
    }
  ],
  "startGrid": [
    {
      "x": 600.24,
      "y": 586.2
    },
    {
      "x": 598.31,
      "y": 542.24
    },
    {
      "x": 642.2,
      "y": 584.36
    },
    {
      "x": 640.27,
      "y": 540.4
    }
  ],
  "tokenSpawns": [
    {
      "x": 328.33,
      "y": 563.6
    },
    {
      "x": 210.31,
      "y": 215.91
    },
    {
      "x": 673.98,
      "y": 162.54
    },
    {
      "x": 798.1,
      "y": 506.22
    }
  ],
  "aiWaypoints": [
    {
      "x": 569.31,
      "y": 565.54
    },
    {
      "x": 529.16,
      "y": 567.3
    },
    {
      "x": 488.98,
      "y": 568.14
    },
    {
      "x": 448.8,
      "y": 568.15
    },
    {
      "x": 408.62,
      "y": 567.28
    },
    {
      "x": 368.48,
      "y": 565.4
    },
    {
      "x": 328.33,
      "y": 563.6
    },
    {
      "x": 288.31,
      "y": 560.13
    },
    {
      "x": 249.27,
      "y": 550.93
    },
    {
      "x": 214.04,
      "y": 531.86
    },
    {
      "x": 184.25,
      "y": 504.99
    },
    {
      "x": 160.59,
      "y": 472.6
    },
    {
      "x": 145.48,
      "y": 435.5
    },
    {
      "x": 139.49,
      "y": 395.83
    },
    {
      "x": 140.4,
      "y": 355.7
    },
    {
      "x": 147.4,
      "y": 316.16
    },
    {
      "x": 160.78,
      "y": 278.33
    },
    {
      "x": 181.93,
      "y": 244.29
    },
    {
      "x": 210.31,
      "y": 215.91
    },
    {
      "x": 242.7,
      "y": 192.17
    },
    {
      "x": 278.12,
      "y": 173.3
    },
    {
      "x": 316.63,
      "y": 162.1
    },
    {
      "x": 356.6,
      "y": 158.21
    },
    {
      "x": 396.71,
      "y": 159.5
    },
    {
      "x": 436.04,
      "y": 167.65
    },
    {
      "x": 475.35,
      "y": 175.95
    },
    {
      "x": 515.4,
      "y": 177.16
    },
    {
      "x": 554.9,
      "y": 169.92
    },
    {
      "x": 594.1,
      "y": 161.1
    },
    {
      "x": 634.08,
      "y": 158.13
    },
    {
      "x": 673.98,
      "y": 162.54
    },
    {
      "x": 712.66,
      "y": 173.31
    },
    {
      "x": 749.68,
      "y": 188.88
    },
    {
      "x": 784.95,
      "y": 208.12
    },
    {
      "x": 817.52,
      "y": 231.57
    },
    {
      "x": 841.99,
      "y": 263.16
    },
    {
      "x": 858.0,
      "y": 300.0
    },
    {
      "x": 874.17,
      "y": 336.78
    },
    {
      "x": 882.41,
      "y": 375.85
    },
    {
      "x": 874.02,
      "y": 414.99
    },
    {
      "x": 855.59,
      "y": 450.59
    },
    {
      "x": 829.1,
      "y": 480.69
    },
    {
      "x": 798.1,
      "y": 506.22
    },
    {
      "x": 764.33,
      "y": 527.96
    },
    {
      "x": 728.02,
      "y": 545.11
    },
    {
      "x": 689.37,
      "y": 555.91
    },
    {
      "x": 649.56,
      "y": 561.27
    },
    {
      "x": 609.46,
      "y": 563.81
    }
  ]
}